<?xml version="1.0" encoding="UTF-8"?>
<mycoreclass xmlns:xlink="http://www.w3.org/1999/xlink" xmlns:xsi="http://www.w3.org/2001/XMLSchema-instance" xsi:noNamespaceSchemaLocation="MCRClassification.xsd" ID="mir_genres">
  <label xml:lang="en" text="genre" description="A list of publication types" />
  <label xml:lang="x-uri" text="http://www.mycore.org/classifications/mir_genres" />
  <label xml:lang="de" text="Genre" description="Liste der Publikationsarten" />
  <categories>
    <category ID="article" counter="1">
      <label xml:lang="en" text="Article / Chapter" />
      <label xml:lang="x-mapping" text="diniPublType:article" />
      <label xml:lang="de" text="Artikel / Aufsatz" />
      <label xml:lang="x-hosts" text="journal newspaper collection festschrift proceedings standalone" />
      <category ID="chapter" counter="0">
        <label xml:lang="en" text="Book chapter" />
        <label xml:lang="de" text="Buchkapitel" />
        <label xml:lang="x-hosts" text="book collection" />
      </category>
      <category ID="entry" counter="0">
        <label xml:lang="en" text="Encyclopedia entry" />
        <label xml:lang="x-hosts" text="lexicon" />
        <label xml:lang="de" text="Lexikoneintrag" />
      </category>
      <category ID="preface" counter="0">
        <label xml:lang="de" text="Vorwort / Nachwort" />
        <label xml:lang="x-hosts" text="journal collection festschrift proceedings lexicon" />
        <label xml:lang="en" text="Preface (foreword) / Postface" />
      </category>
      <category ID="speech" counter="0">
        <label xml:lang="en" text="Lecture / Speech" />
        <label xml:lang="de" text="Vortrag" />
        <label xml:lang="x-hosts" text="proceedings standalone" />
      </category>
      <category ID="review" counter="0">
        <label xml:lang="de" text="Rezension" />
        <label xml:lang="en" text="Review" />
        <label xml:lang="x-hosts" text="journal newspaper collection festschrift proceedings standalone" />
      </category>
    </category>
    <category ID="thesis" counter="2">
      <label xml:lang="en" text="Thesis" />
      <label xml:lang="de" text="Hochschulschriften" />
      <label xml:lang="x-hosts" text="series standalone" />
      <label xml:lang="x-editor" text="false" />
      <category ID="exam" counter="0">
        <label xml:lang="de" text="Examensarbeit" />
        <label xml:lang="en" text="Exam" />
        <label xml:lang="x-hosts" text="series standalone" />
      </category>
      <category ID="dissertation" counter="0">
        <label xml:lang="de" text="Dissertation" />
        <label xml:lang="x-hosts" text="series standalone" />
        <label xml:lang="en" text="Dissertation" />
      </category>
      <category ID="habilitation" counter="0">
        <label xml:lang="de" text="Habilitation" />
        <label xml:lang="x-hosts" text="series standalone" />
        <label xml:lang="en" text="Habilitation" />
      </category>
      <category ID="diploma_thesis" counter="0">
        <label xml:lang="x-hosts" text="series standalone" />
        <label xml:lang="en" text="Diploma thesis" />
        <label xml:lang="de" text="Diplomarbeit" />
      </category>
      <category ID="master_thesis" counter="0">
        <label xml:lang="x-mapping" text="diniPublType:masterThesis" />
        <label xml:lang="en" text="Master thesis" />
        <label xml:lang="de" text="Abschlussarbeit (Master)" />
        <label xml:lang="x-hosts" text="series standalone" />
      </category>
      <category ID="bachelor_thesis" counter="2">
        <label xml:lang="x-mapping" text="diniPublType:StudyThesis" />
        <label xml:lang="de" text="Abschlussarbeit (Bachelor)" />
        <label xml:lang="en" text="Bachelor thesis" />
        <label xml:lang="x-hosts" text="series standalone" />
      </category>
      <category ID="student_resarch_project" counter="0">
        <label xml:lang="en" text="Student research project" />
        <label xml:lang="x-hosts" text="series standalone" />
        <label xml:lang="de" text="Studienarbeit" />
      </category>
      <category ID="magister_thesis" counter="0">
        <label xml:lang="en" text="Magister thesis" />
        <label xml:lang="de" text="Magisterarbeit" />
        <label xml:lang="x-hosts" text="series standalone" />
      </category>
    </category>
    <category ID="collection" counter="0">
      <label xml:lang="de" text="Sammelwerk" />
      <label xml:lang="x-hosts" text="series standalone" />
      <label xml:lang="en" text="Collection" />
      <category ID="festschrift" counter="0">
        <label xml:lang="en" text="Festschrift" />
        <label xml:lang="x-hosts" text="series standalone" />
        <label xml:lang="de" text="Festschrift" />
      </category>
      <category ID="proceedings" counter="0">
        <label xml:lang="en" text="Proceedings" />
        <label xml:lang="de" text="Tagungsband" />
        <label xml:lang="x-hosts" text="series standalone" />
      </category>
      <category ID="lexicon" counter="0">
        <label xml:lang="x-hosts" text="series standalone" />
        <label xml:lang="en" text="Lexicon" />
        <label xml:lang="de" text="Lexikon" />
      </category>
    </category>
    <category ID="report" counter="0">
      <label xml:lang="x-hosts" text="standalone" />
      <label xml:lang="de" text="Report" />
      <label xml:lang="en" text="Report" />
      <category ID="research_results" counter="0">
        <label xml:lang="x-hosts" text="standalone" />
        <label xml:lang="en" text="Research Results" />
        <label xml:lang="de" text="Forschungsergebnisse" />
      </category>
      <category ID="in_house" counter="0">
        <label xml:lang="x-hosts" text="standalone" />
        <label xml:lang="en" text="In house" />
        <label xml:lang="de" text="Hausinterne Veröffentlichung" />
      </category>
      <category ID="press_release" counter="0">
        <label xml:lang="x-hosts" text="standalone" />
        <label xml:lang="de" text="Presseerklärung" />
        <label xml:lang="en" text="Press release" />
      </category>
      <category ID="declaration" counter="0">
        <label xml:lang="x-hosts" text="standalone" />
        <label xml:lang="de" text="Fachliche Stellungnahme" />
        <label xml:lang="en" text="Professional declaration" />
      </category>
    </category>
    <category ID="teaching_material" counter="0">
      <label xml:lang="de" text="Lehrmaterial" />
      <label xml:lang="x-hosts" text="standalone lecture" />
      <label xml:lang="en" text="Teaching Resource" />
      <category ID="lecture_resource" counter="0">
        <label xml:lang="x-hosts" text="standalone lecture" />
        <label xml:lang="de" text="Vorlesungsmaterial" />
        <label xml:lang="en" text="Lecture Resource" />
      </category>
      <category ID="course_resources" counter="0">
        <label xml:lang="x-hosts" text="standalone lecture" />
        <label xml:lang="de" text="Kurs- und Seminarmaterial" />
        <label xml:lang="en" text="Course Resources" />
      </category>
    </category>
    <category ID="book" counter="0">
      <label xml:lang="de" text="Buch" />
      <label xml:lang="x-hosts" text="series standalone" />
      <label xml:lang="en" text="Book" />
    </category>
    <category ID="journal" counter="0">
      <label xml:lang="x-hosts" text="standalone" />
      <label xml:lang="en" text="Journal" />
      <label xml:lang="de" text="Zeitschrift" />
    </category>
    <category ID="newspaper" counter="0">
      <label xml:lang="x-hosts" text="standalone" />
      <label xml:lang="en" text="Newspaper" />
      <label xml:lang="de" text="Zeitung" />
    </category>
    <category ID="series" counter="0">
      <label xml:lang="x-hosts" text="standalone" />
      <label xml:lang="en" text="Series" />
      <label xml:lang="de" text="Serie" />
    </category>
    <category ID="interview" counter="0">
      <label xml:lang="x-hosts" text="journal newspaper standalone" />
      <label xml:lang="en" text="Interview" />
      <label xml:lang="de" text="Interview" />
    </category>
    <category ID="research_data" counter="0">
      <label xml:lang="de" text="Forschungsdaten" />
      <label xml:lang="x-host" text="standalone" />
      <label xml:lang="en" text="Research Data" />
    </category>
    <category ID="patent" counter="0">
      <label xml:lang="x-hosts" text="standalone" />
      <label xml:lang="de" text="Patent" />
      <label xml:lang="en" text="Patent" />
    </category>
    <category ID="poster" counter="0">
      <label xml:lang="en" text="Poster" />
      <label xml:lang="de" text="Poster" />
      <label xml:lang="x-hosts" text="proceedings standalone" />
    </category>
    <category ID="audio" counter="0">
      <label xml:lang="en" text="Audio file" />
      <label xml:lang="x-hosts" text="standalone lecture" />
      <label xml:lang="de" text="Tondokument" />
    </category>
    <category ID="video" counter="0">
      <label xml:lang="x-hosts" text="standalone lecture" />
      <label xml:lang="de" text="Film / Video" />
      <label xml:lang="en" text="Movie / Video" />
    </category>
    <category ID="picture" counter="0">
      <label xml:lang="x-hosts" text="standalone lecture" />
      <label xml:lang="de" text="Bild" />
      <label xml:lang="en" text="Picture" />
    </category>
    <category ID="broadcasting" counter="0">
      <label xml:lang="x-hosts" text="standalone" />
      <label xml:lang="de" text="Sendung" />
      <label xml:lang="en" text="Broadcasting" />
    </category>
    <category ID="lecture" counter="0">
      <label xml:lang="x-hosts" text="standalone" />
      <label xml:lang="de" text="Vorlesung" />
      <label xml:lang="en" text="Lecture" />
    </category>
  </categories>
</mycoreclass>
