<?xml version="1.0" encoding="UTF-8"?>
<mycoreclass ID="SDNB2" xmlns:xsi="http://www.w3.org/2001/XMLSchema-instance" xsi:noNamespaceSchemaLocation="MCRClassification.xsd">
  <label xml:lang="x-auth" text="sdnb"/>
  <label xml:lang="x-uri" text="http://www.mycore.org/classifications/SDNB"/>
  <categories>
    <category ID="x">
      <category ID="x-1">
        <category ID="x-1-1"/>
      </category>
    </category>
    <category ID="y"/>
    <category ID="z"/>
  </categories>
</mycoreclass>
