<?xml version="1.0" encoding="UTF-8"?>
<mycoreclass ID="rfc5646" xmlns:xsi="http://www.w3.org/2001/XMLSchema-instance" xsi:noNamespaceSchemaLocation="MCRClassification.xsd">
  <label xml:lang="x-auth" text="rfc5646"/>
  <categories>
    <category ID="x">
      <category ID="x-1">
        <category ID="x-1-1"/>
      </category>
    </category>
    <category ID="y"/>
    <category ID="z"/>
  </categories>
</mycoreclass>
